id,author,work_title,title,section,text,word_count,language
120,Ambrosius von Mailand,Über die Jungfräulichkeit,Über die Jungfräulichkeit,9,"Folgen wir ihm durch den Glanz des Tages! Es ist der Tag, der in seiner Kirche hell leuchtet, jener Tag, den Abraham sah mit hoher Freude. Folgen wir Christo durch den Glanz des Tages; im Dunkel der Nacht findet man ihn nicht. „Auf meinem Bettlein in den Nächten suchte ich ihn, den meine Seele liebet: ich suchte ihn, aber ich fand ihn nicht; ich rief ihn, aber er hörte mich nicht. 3",72,deutsch
121,Ambrosius von Mailand,Über die Jungfräulichkeit,Über die Jungfräulichkeit,10,"Auch in der Unruhe des Lebens, auf den Wegen des öffentlichen Treibens wird Christus nicht gefunden. Daher die Klage: „Ich will aufstehen und herumgehen in der Stadt, in den Gassen und Straßen suchen ihn, den meine Seele liebt; ich suchte ihn, aber ich fand ihn nicht.",46,deutsch
122,Ambrosius von Mailand,Über die Jungfräulichkeit,Über die Jungfräulichkeit,11,"Wir dürfen also den Herrn da nicht suchen, wo wir ihn nichtfinden können. Was hat denn Christus mit dem Treiben des Forums gemein? Er ist der Friede und auf dem Forum herrscht der Streit; er ist die Gerechtigkeit, hier ist Ungerechtigkeit; er ist allezeit thätig, hier herrscht eitler Müssiggang; er ist lauter Liebe, und wie viel Schmähsucht verletzt auf dem Forum die Gesetze der Liebe!",65,deutsch
123,Ambrosius von Mailand,Über die Jungfräulichkeit,Über die Jungfräulichkeit,12,"Hier stehen Götzen, denen die Menschen ihr Opfer bringen; Christus aber wohnt in seiner heiligen Kirche. An einem anderen Orte wendeten wir uns bereits an eine Wittwe mit tadelnden Worten, aber sie mußte erkennen, daß es uns nicht darum zu thun war, sie zu schmähen, sondern bloß zu mahnen.",49,deutsch
124,Ambrosius von Mailand,Über die Jungfräulichkeit,Über die Jungfräulichkeit,13,"So möge sie auch jetzt mich nicht als einen harten Menschen beurtheilen, sondern nur als sehr besorgt um sie; ich begehre Zulassung, um ihr die volle Aussöhnung zu bieten: denn in der Kirche wird die Wittwe zur Gerechtigkeit geführt, im Gewirre des öffentlichen Lebens wird sie betrogen.",47,deutsch
125,Ambrosius von Mailand,Über die Jungfräulichkeit,Über die Jungfräulichkeit,14,So meiden wir denn das Treiben des Forums und der Straße!,11,deutsch
126,Ambrosius von Mailand,Über die Jungfräulichkeit,Über die Jungfräulichkeit,15,"Dann aber sage zu der Weisheit: „Du bist meine Schwester, und nenne die Klugheit „deine Freundin, damit sie dich bewahre vor dem fremden und buhlerischen Weibe. . . Sie schaut aus dem Fenster ihres Hauses nieder auf die Straßen. 4Fliehen wir also die öffentlichen Straßen.",45,deutsch
127,Ambrosius von Mailand,Über die Jungfräulichkeit,Über die Jungfräulichkeit,16,"Es schließt nicht bloß eine Kränkung ein, den nicht gefunden zu haben, welchen man suchte; nein es bleibt auch nicht ohne eigentlichen Nachtheil, da wo man es nicht durfte, mehr aus Vorwitz als in rechter Gesinnung gesucht zu haben: in den Häusern von Männern nämlich, die sich zu Unrecht den Namen von Lehrern beilegen.",54,deutsch
128,Ambrosius von Mailand,Über die Jungfräulichkeit,Über die Jungfräulichkeit,17,"Hüten wir uns, daß nicht die Kirche jene Worte5auf sich um unseretwillen beziehen müsse: „Da fanden mich die Wächter, die in der Stadt umhergehen; die schlugen mich und verwundeten mich; die Wächter der Mauern nahmen mir meinen Mantel. Wir wiederholen es: nicht in sichselbst, nein in uns ist die Kirche verwundet.",51,deutsch
129,Ambrosius von Mailand,Über die Jungfräulichkeit,Über die Jungfräulichkeit,18,"So hüten wir uns denn, daß wir nicht durch unseren Fall die Kirche verwunden; hüten wir uns, daß Jemand „uns den Mantel nehme , das heißt den Schmuck der Weisheit und Geduld, welcher die weichlichere Umhüllung ausschließt. Denn „die mit weichen Kleidern angethan sind, die weilen in den Häusern der Könige.",51,deutsch
130,Ambrosius von Mailand,Über die Jungfräulichkeit,Über die Jungfräulichkeit,19,"Uns aber hat Christus den Mantel verliehen, in den er auch seine Apostel und seinen eigenen heiligen Leib hüllte. Befiehlt er nun, demjenigen, welcher den Rock erbitte, auch noch den Mantel zu geben, so heißt das nichts anderes, als: wir sollen das Gewand unserer Weisheit ihm geben und den, welcher vorher nackt und bloß war, damit bekleiden.",57,deutsch
131,Ambrosius von Mailand,Über die Jungfräulichkeit,Über die Jungfräulichkeit,20,"Sprüchw. 7, 4 ff. Das Citat ist nach den LXX.",10,deutsch
132,Ambrosius von Mailand,Über die Jungfräulichkeit,Über die Jungfräulichkeit,1,"So suchen wir denn Christus dort, wo ihn die Kirche sucht, auf jenen Höhen, um deren Gipfel der himmlische Duft erhabenster Tugendwerke sich webt. Er meidet die Straßen, er entzieht sich dem geräuschvollen Treiben des Marktes, nach jenen Worten: „Flieh , mein Geliebter, und werde gleich einem Rehe, gleich jungen Hirschen auf den Gewürzbergen! 1Verhaßt all denen, welche, wie niedriges Gewürm, immerdar am Boden haften, wohnt der Herr nur bei erhabener Tugend; er weilt nur bei solchen Töchtern der Kirche, welche von sich sagen können:2„Wir sind Gott ein Wohlgeruch Christi unter denen, die gerettet werden, und unter denen, die zu Grunde gehen: den Einen nämlich ein Geruch des Todes zum Tode, den Andern ein Geruch des Lebens zum Leben, solchen nämlich, welche mit lebendigem Glauben den Auferstandenen umfassen.",128,deutsch
133,Ambrosius von Mailand,Über die Jungfräulichkeit,Über die Jungfräulichkeit,2,"Diejenigen also haben die Höhe des Glaubens in muthigem Tugendlaufe erstiegen, welche glauben, daß Jesus gestorben und begraben ist, die im Geiste seinen heiligen Leib zu dem Felsengrabe geleitet und mit Spezereien gesalbt haben; die aber auch wissen, daß der Herr glorreich auferstanden ist.",44,deutsch
134,Ambrosius von Mailand,Über die Jungfräulichkeit,Über die Jungfräulichkeit,3,"Wo aber ist Christus hiernach sicherer zu finden, als in dem Geiste weiser Priester?!",14,deutsch
135,Ambrosius von Mailand,Über die Jungfräulichkeit,Über die Jungfräulichkeit,4,"Der Herr selbst deutet uns an, wo er zu finden ist. „Ich bin eine Blume des Feldes und eine Lilie in den Thälern, ja wie eine Lilie mitten unter den Dörnern. 3Siehe da, wo er weilt: „Eine Blume des Feldes nennt er sich, weil er die offene Einfalt reiner Herzen liebt und aufsucht; „eine Lilie in den Thälern , weil er die höchste Blüthe heiliger Demuth ist. „Wie eine Lilie unter den Dörnern erscheint er: oder erwächst er nicht unter den geistigen Beschwerden dieses Lebens, unter den Reueschmerzen der Seele als göttliche Blume voll himmlischen Duftes?",96,deutsch
136,Ambrosius von Mailand,Über die Jungfräulichkeit,Über die Jungfräulichkeit,5,"Darum ruht auch das Auge Gottes versöhnt auf solchen Herzen, die in Reue vor ihm sich beugen.",17,deutsch
137,Ambrosius von Mailand,Über die Jungfräulichkeit,Über die Jungfräulichkeit,6,"Das ist die Wüste, meine Töchter! welche zum Himmelreiche führt; das ist auch jene Wüste, welche im Lilienblüthenschmuck erglänzt nach den Worten des Propheten4: „Da freuet sich die öde, ungebahnte Wüste, da frohlocket die Einöde und blühet wie eine Lilie. In dieser Wüste erhebt sich der gute Baum, welcher gute Früchte trägt: er beginnt seine Zweige weithin auszudehnen, seine Wipfel aber reichen zum Himmel, zum Schooße der Gottheit hinauf.",69,deutsch
138,Ambrosius von Mailand,Über die Jungfräulichkeit,Über die Jungfräulichkeit,7,"Möchte doch auch den Baum unseres Lebens ein befruchtender Strahl der Gottheit treffen, so daß das Wort paßte:5„Wie ein Apfelbaum unter den Bäumen des Waldes, so ist mein Geliebter unter den Söhnen. Dann würde die Kirche sich freuen und jubelnd ausrufen: „Unter seinem Schatten, wonach ich verlangt habe, sitze ich, und seine Früchte sind süß meinem Gaumen.",57,deutsch
139,Ambrosius von Mailand,Über die Jungfräulichkeit,Über die Jungfräulichkeit,8,"Ja, die Kirche würde in unserem Anblicke und erfreut über die Frucht unseres Glaubens, die schon gezeitigt ist, ausrufen: „Er führet mich in die Keller, gefüllt mit Wein, und ordnet in mir die Liebe. Die Liebe kann ja nicht ohne den Glauben bestehen; die Kirche aber hat als dreifache Bürgschaft für ihre göttliche Stiftung: Glauben, Hoffnung, Liebe.",57,deutsch
140,Ambrosius von Mailand,Über die Jungfräulichkeit,Über die Jungfräulichkeit,9,"Ist die Hoffnung lebendig geworden, ist der Glaube fest gegründet, dann wird auch die Liebe eingesenkt, und ihr Band umschlingt dann die Kirche.",23,deutsch
141,Ambrosius von Mailand,Über die Jungfräulichkeit,Über die Jungfräulichkeit,10,"II. Kor. 2, 15. Die Bezugnahme auf diese Stelle ist rein willkürlich und bloß durch gleichlautende Worte veranlaßt. Der Apostel spricht von den Predigern des Evangeliums, die ein Gott wohlgefälliger Opfergeruch sind, sofern der Geist Christi sie erfüllt.",38,deutsch
142,Ambrosius von Mailand,Über die Jungfräulichkeit,Über die Jungfräulichkeit,1,"So habt ihr denn erkannt, wo Christus gesucht wird; suchet nun auch zu erkennen, wie man verdient, daß Christus uns sucht. Rufe den heiligen Geist an mit jenen Worten des hohen Liedes:1„Hebe dich, Nordwind, und komme, Südwind! Durchwehe meinen Garten, so werden feine Gewürze fließen.",45,deutsch
143,Ambrosius von Mailand,Über die Jungfräulichkeit,Über die Jungfräulichkeit,2,Mein Geliebter komme in seinen Garten und esse die Früchte seiner Aepfel. Der Garten des ewigen Wortes ist die in frommer Gesinnung erblühende Seele; die Werke ihrer Tugend sind die Früchte.,31,deutsch
144,Ambrosius von Mailand,Über die Jungfräulichkeit,Über die Jungfräulichkeit,3,"Er kommt also, und du magst essen oder trinken, wenn du Christus rufest, so ist er da und spricht zu dir: „Kommet, esset mein Brod und trinket den Wein, den ich euch gemischt habe. 2Auch wenn du schläfst, steht er pochend an deiner Thüre.",44,deutsch
145,Ambrosius von Mailand,Über die Jungfräulichkeit,Über die Jungfräulichkeit,4,"Ja er kommt oft, aber nicht immer, auch nicht zu Allen, sondern nur zu jener Seele, welche sagen kann: „Abgelegt zur Nachtzeit habe ich mein Gewand. 3Hinsinken muß erst in der Nacht dieses Lebens die Hülle des sterblichen Leibes, wie auch der Herr seines irdischen Fleisches sich entäußerte, um für dich über die Mächte und Gewalten dieser Welt zu triumphiren.",60,deutsch
146,Ambrosius von Mailand,Über die Jungfräulichkeit,Über die Jungfräulichkeit,5,"„Wie soll ich aber das Gewand wieder anziehen? spricht die Gott geweihete Seele ferner. So vollständig entwöhntsie sich der fleischlichen Handlungen, so vollständig entäußert sie sich irdischer Gesinnung, daß sie gar nicht weiß, wie sie jene — auch wenn sie wollte — von Neuem annehmen könnte.",46,deutsch
147,Ambrosius von Mailand,Über die Jungfräulichkeit,Über die Jungfräulichkeit,6,Die Gewöhnung im Guten hebt die alt und lieb gewordene böse Gewohnheit auf.,13,deutsch
148,Ambrosius von Mailand,Über die Jungfräulichkeit,Über die Jungfräulichkeit,7,"„Ich habe meine Füße gewaschen, wie soll ich sie wieder besudeln? Das Evangelium belehrt uns, daß das Waschen der Füße das Geheimniß des Glaubens bedeutet und das Zeichen wahrer Demuth ist, nach jenen Worten des Herrn:4„Wenn nun ich, euer Herr und Meister, euch die Füße wasche, um wie viel mehr müsset dann ihr der Eine des Andern Füße waschen. Dieses Wort mahnt zur Demuth.",64,deutsch
149,Ambrosius von Mailand,Über die Jungfräulichkeit,Über die Jungfräulichkeit,8,"Hinsichtlich des Geheimnisses aber muß daran erinnert werden, was der Herr zu Petrus sagt: „Wenn ich dir die Füße nicht wasche, so wirst du keinen Theil an mir haben. Ward das dem Petrus gesagt, was wird dann uns gelten?",39,deutsch
150,Ambrosius von Mailand,Über die Jungfräulichkeit,Über die Jungfräulichkeit,9,"Wer aber die Füße gewaschen hat, der bedarf nach dem Ausspruche des Herrn nichts weiter; aber darum soll er sich auch hüten, sie wieder zu besudeln. Die Kirche sagt mit Recht: „Ich habe meine Füße gewaschen, aber sie setzt nicht hinzu: Wie werde ich sie nochmals waschen? sondern: „Wie soll ich sie wieder besudeln?",54,deutsch
151,Ambrosius von Mailand,Über die Jungfräulichkeit,Über die Jungfräulichkeit,10,"So ganz hat sie vergessen der alten Makel und Schmach. So zeigt uns der Herr durch äußere Handlung, wie wir die geistigen Spuren unserer Handlungen abwaschen sollen. Hast du einmal deine Füße mit dem lebendigen Quellwasser aus Himmels Höhen gewaschen und im Geheimniß des Sakramentes dich gereinigt: ach! dann hüte dich aber auch, daß nicht von Neuem der Schmutz fleischlicher Begierden und sündhafter Handlungen dich besudle.",66,deutsch
152,Ambrosius von Mailand,Über die Jungfräulichkeit,Über die Jungfräulichkeit,11,"Das sind aber jene Füße, die David im Geiste gewaschen, wenn er uns lehrt, wie wir vermeiden, sie wieder zu beflecken: „Es stehen unsere Füße in deinen Vorhöfen,Jerusalem! 5Da denkt er nicht an leibliche, sondern an geistige Füße. Denn wie könnte ein sterblicher, irdischer Mensch seine leiblichen Füße setzen in die Räume des Himmels?",54,deutsch
153,Ambrosius von Mailand,Über die Jungfräulichkeit,Über die Jungfräulichkeit,12,Jerusalem ist aber nach dem Zeugnisse des Apostels der Himmel; er sagt ja nicht minder: „Unser Wandel ist im Himmel! 6der Wandel in gläubiger frommer Sitte.,26,deutsch
154,Ambrosius von Mailand,Über die Jungfräulichkeit,Über die Jungfräulichkeit,1,"Wer nun so lebt, der darf sagen: „Mein Geliebter streckte seine Hand durch die Oeffnung, und ich erzitterte, da ich sie berührte. Ich stand auf, meinem Geliebten zu öffnen. 1Es ist recht, daß wir bei der Ankunft des Herrn in tiefster Seele erschüttert werden.",44,deutsch
155,Ambrosius von Mailand,Über die Jungfräulichkeit,Über die Jungfräulichkeit,2,"Wenn schon Maria bei der Ankunft des Engels erschrack, um wie viel mehr müssen wir bewegt werden bei der Ankunft Christi! Wenn göttliches Leben einströmt in unsere Seele, dann weicht die irdische Gesinnung, und die alten Gewohnheiten des äußerlichen Menschen schwinden.",41,deutsch
156,Ambrosius von Mailand,Über die Jungfräulichkeit,Über die Jungfräulichkeit,3,"Darum eile mit tiefer Bewegung ihm entgegen. Siehe, Christus weilt an der Pforte, er klopft an der Thüre deines Hauses: wenn du ihm öffnest, so tritt er ein, er mit seinem himmlischen Vater.",33,deutsch
157,Ambrosius von Mailand,Über die Jungfräulichkeit,Über die Jungfräulichkeit,4,"Christus, unser Heiland, spendet aber seine Segnungen nicht bloß, nachdem er in die Seele eingetreten ist; nein, schon vorher lenkt er seine Gnadenströmungen in die Seele, die ihm entgegenkommen will. Noch erzittert die Seele unter der Berührung seiner göttlichen Hand; kaum hat sie das Thor ihres Herzens für Christus geöffnet, da sinken schon die Bande, die Fleisch und Blut aus Sinnlichkeit geflochten: „Ich stand auf, kann sie sagen mit der Braut des hohen liedes, „meinem Geliebten aufzumachen: meine Hände triefen von Myrrhen, und meine Finger waren voll der köstlichsten Myrrhen.",90,deutsch
158,Ambrosius von Mailand,Über die Jungfräulichkeit,Über die Jungfräulichkeit,5,"So trug Nikodemus, jener Lehrer in Israel, der zuerst von dem Geheimnisse der Taufe hören durfte,Myrrhe und Aloe zum Grabe des Herrn, um seinen heiligen Leichnam damit zu salben. Ist nun beides nicht Sinnbild des himmlischen Geruches vollkommenen Glaubens?",39,deutsch
159,Ambrosius von Mailand,Über die Jungfräulichkeit,Über die Jungfräulichkeit,6,"So steigt der Duft der Seele empor, welche Christo zu öffnen beginnt; die treu und fest glaubt, daß sein heiliger Leib die Verwesung nicht geschaut hat, daß er vielmehr als eine duftende, ewig grünende Himmelsblüthe glorreich die Hülle des Grabes durchbrochen hat. Wie kann es anders sein?",47,deutsch
160,Ambrosius von Mailand,Über die Jungfräulichkeit,Über die Jungfräulichkeit,7,"Ist doch sein Name wie ausgegossen Oel! Daß es für uns dufte, darum hat er sich bis zur Menschwerdung vernichtet.",20,deutsch
161,Ambrosius von Mailand,Über die Jungfräulichkeit,Über die Jungfräulichkeit,8,"So lange das ewige Wort beim Vater weilte, erfreute es in Himmelsduft nur die Engel und Erzengel. Der Vater aber öffnete seinen Mund und sprach:2„Siehe, ich mache dich zum Lichte der Heiden, daß du mein Heil bis an der Erde Gränzen bringest.",42,deutsch
162,Ambrosius von Mailand,Über die Jungfräulichkeit,Über die Jungfräulichkeit,9,"Da stieg der Sohn hernieder, und Alles strömte über von dem nie geahnten Wohlgeruche des Wortes. Es entquoll dem Herzen des Vaters das Wort, das herabkam, und der heilige Geist hauchte in alle Herzen die Liebe. „Denn ausgegossen, sagt der Apostel, „ist die Liebe Gottes in unseren Herzen durch den heiligen Geist.",52,deutsch
163,Ambrosius von Mailand,Über die Jungfräulichkeit,Über die Jungfräulichkeit,10,"Er verschloß seine Himmelslehre, wie der Duft eingeschlossen bleibt im Gefäße, bis seine Stunde gekommen nach den Worten des Propheten:3„Der Herr gab mir eine beredte Zunge, daß ich zu reden wüßte, wann die Zeit gekommen. Es kam die Stunde, er that auf seinen Mund, und wie kostbares Oel waren seine Worte.",51,deutsch
164,Ambrosius von Mailand,Über die Jungfräulichkeit,Über die Jungfräulichkeit,11,"Ausgegossen ward das Oel über die Juden, aber aufgesammelt von den Völkern; ausgegossen in Judäa streut es seinen Wohlgeruch durch alle Lande. Es hat die Wasser der Gnade berührt und geheiligt: es strömt fort seit jener Zeit und nie wird es versiegen.",42,deutsch
165,Ambrosius von Mailand,Über die Jungfräulichkeit,Über die Jungfräulichkeit,12,"Kommet ihr heiligen Jungfrauen, tretet hinzu, nehmet von diesem Oele, bewahret es sicher, daß es nicht verrinnet. Hüte den Schatz in keuschem, treuem,demüthigem Sinne! So könnet ihr Christus aufnehmen und sagen: „Ich machte auf meinem Geliebten den Riegel meiner Thür; nun tritt er ein und dringt bis in die Tiefen der Seele.",52,deutsch
166,Ambrosius von Mailand,Über die Jungfräulichkeit,Über die Jungfräulichkeit,1,"Wohlan denn, Seele, auch du bist aus dem erwählten Volke: denn bei Gott gilt kein Unterschied nach irdischem Range, nichts gilt ihm goldverbrämtes Gewand, nichts kostbarer Halsschmuck; auch du bist eine jener Jungfrauen, die des Körpers Schönheit durch den Glanz der Seele vergeistigen!",43,deutsch
167,Ambrosius von Mailand,Über die Jungfräulichkeit,Über die Jungfräulichkeit,2,So vergiß denn auch nicht auf deinem Lager während der Nacht allezeit Christi zu gedenken und auf seine Ankunft zu harren.,21,deutsch
168,Ambrosius von Mailand,Über die Jungfräulichkeit,Über die Jungfräulichkeit,3,"Scheint er dir aber zu zögern, so erhebe dich von deinem Lager! Gibst du weichlicher Ruhe dich hin, lässest du ab vom Gebete, erhebst du deine Stimme nicht in heiligen Psalmengesängen:dannscheint er zu zögern. Weihe ihm die Erstlinge des erwachenden Tages, bringe ihm dar die Erstlinge deiner Werke.",48,deutsch
169,Ambrosius von Mailand,Über die Jungfräulichkeit,Über die Jungfräulichkeit,4,"Hast du nicht gehört, daß er dich gerufen mit den Worten: „Komme vom Libanon, meine Braut! komme vom Libanon! Du wirst herniedersteigen und hindurchgehen vom Beginne des Glaubens an. Ja, du wirst herniedersteigen, um in der Welt zu kämpfen; aber du wirst hindurchschreiten durch die Welt bis zu Christus, um bei ihm deine Triumphe zu feiern. — Er hat dir gesagt, daß er dich befreit von den Angriffen der Löwen und Leoparden, das heißt der gewaltigen Feinde unserer Seelen; und hast du nicht gehört, daß ihm die Schönheit deiner Tugend gar sehr gefällt? daß der Geruch deiner Kleider, das heißt deiner jungfräulichen Reinigkeit, ihm ist wie des Weihrauchs Geruch?",109,deutsch
170,Ambrosius von Mailand,Über die Jungfräulichkeit,Über die Jungfräulichkeit,5,"Hast du nicht gehört, daß du bist wie ein verschlossener Garten, wie ein Paradies, gefüllt mit herrlichen Früchten? Ach flehe, daß der Hauch des göttlichen Geistes hinwehe über dein Lager und mit heiligem, reinem Sinne dich erfülle. Dann zögert er nicht; dann wird er dir antworten: „Ich schlafe, aber mein Herz wachet.",52,deutsch
171,Ambrosius von Mailand,Über die Jungfräulichkeit,Über die Jungfräulichkeit,6,"Du hast das Pochen seiner göttlichen Hand an die Thüre deines Herzens, du hast seine Stimme gehört: „Thue mir auf, meine Schwester, meine Freundin, meine Taube, meine Unbefleckte; denn mein Haupt ist voll des Thaues, meine Locken sind voll nächtlicher Tropfen!",41,deutsch
172,Ambrosius von Mailand,Über die Jungfräulichkeit,Über die Jungfräulichkeit,7,"Wie der Thau des Himmels die Dürre der Nacht verscheucht, so hat der Herr Jesus Christus mit dem Thaue des ewigen Lebens die Finsterniß irdischen Daseins erquickt. So hört das gequälte Haupt auf unter der Hitze zu leiden. Das Haupt des Herrn strömt über von Thau, Anderen aber zum höchsten Gewinne.",51,deutsch
173,Ambrosius von Mailand,Über die Jungfräulichkeit,Über die Jungfräulichkeit,8,"Ist ja Christus auch dein Haupt, er, dessen Freigebigkeit niemals erschöpft wird trotz der täglichen Spende.",16,deutsch
174,Ambrosius von Mailand,Über die Jungfräulichkeit,Über die Jungfräulichkeit,9,"Weißt du nun, wie jener Thau nicht irdischen Ursprunges ist? Siehe, seine Locken sind voll nächtlicher Tropfen. Und sind das Locken irdischen Schmuckes, Waffen der Eitelkeit, Lockmittel der Sinnlichkeit? Nein, der Nasiräer, dessen Haupthaar kein Scheermesser berührt, läßt sein Haupt umwallen von Strahlen göttlicher Tugendwerke. Bewahre dir solche Locken!",49,deutsch
175,Ambrosius von Mailand,Über die Jungfräulichkeit,Über die Jungfräulichkeit,10,"Vergiß es nicht: so lange Samson sie in ganzer Fülle bewahrte, konnte er nicht überwunden werden. Er gab sie preis, und seine Kraft wich von ihm.",26,deutsch
176,Ambrosius von Mailand,Über die Jungfräulichkeit,Über die Jungfräulichkeit,11,"Siehe, so wünscht dich Christus, so hat er dich erwählt. Oeffnest du ihm dein Herz, so tritt er ein: er hat es versprochen, und er täuscht niemals. Umfasse ihn, den du so lange gesucht hast; tritt nahe hin zu ihm, und der Strahl seiner Gnade wird dich erleuchten.",48,deutsch
177,Ambrosius von Mailand,Über die Jungfräulichkeit,Über die Jungfräulichkeit,12,"Halte ihn fest umschlossen; bitte ihn, daß er nicht von dir weiche. Aber er geht von dir, wenn er Gleichgültigkeit bemerkt; er bleibt nicht, wenn du ihn vernachlässigst.",28,deutsch
178,Ambrosius von Mailand,Über die Jungfräulichkeit,Über die Jungfräulichkeit,13,"Was sagt aber die Braut des hohen Liedes? „Ich suchte ihn, aber ich fand ihn nicht; ich rief ihn, aber er antwortete mir nicht. Glaube jedoch nicht, daß du ihm mißfallest, weil du gerufen, geöffnet, gefleht hast und er doch von dir gewichen ist: er läßt ja nicht selten zu, daß wir geprüft werden.",54,deutsch
179,Ambrosius von Mailand,Über die Jungfräulichkeit,Über die Jungfräulichkeit,14,"Was antwortete er einst, da die Schaaren ihn baten, daß er nicht von ihnen gehen möge? „Auch anderen Städten muß ich das Wort des Herrn verkünden denndafür bin ich gesandt. Will es dich denn bedünken, daß er von dir fortgegangen, so gehe hin, von Neuem ihn zu suchen.",48,deutsch
180,Ambrosius von Mailand,Über die Jungfräulichkeit,Über die Jungfräulichkeit,15,"Fürchte also jene Wächter nicht, von denen es im hohen Liede heißt: „Sie gehen sichtbar in der Stadt umher. Fürchte nicht die Wunden, die sie schlagen können; denen, die Christo folgen, schaden sie nimmer. Und könnten sie selbst dein Leibesleben dir nehmen, so bleibt doch Christus, der das Leben selbst ist, dir nahe.",53,deutsch
181,Ambrosius von Mailand,Über die Jungfräulichkeit,Über die Jungfräulichkeit,16,"Hast du ihn gefunden, so denke nur auf Eins, wo du mit ihm weilen mußt, daß er dich nicht verlasse. Gar schnell scheidet er von denen, die ihn vernachlässigen.",29,deutsch
182,Ambrosius von Mailand,Über die Jungfräulichkeit,Über die Jungfräulichkeit,1,"Wer anders aber kann dich lehren, wie du Christus zurückhältst, als unsere heilige Kirche? Ja, sie hat es dich schon gelehrt, wenn du nur jene Worte des hohen Liedes erkennen willst: „Kaum war ich an ihnen vorübergegangen, da fand ich ihn, den meine Seele liebt; ich hielt ihn und will ihn nimmer lassen. Und wodurch wird er gehalten?",58,deutsch
183,Ambrosius von Mailand,Über die Jungfräulichkeit,Über die Jungfräulichkeit,2,"Ach nur durch die Bande der Liebe, nur durch die hingebende Gesinnung eines treuen Gemüthes. Wenn du willst, so kannst auch du ihn halten; suche nur eifrig, fürchte keine Mühe, keine Pein! Oft genug wird er gerade mitten in den Qualen des Körpers, ja unter den Händen der Verfolger gefunden. „Kaum war ich an ihnen vorübergegangen hieß es ja.",59,deutsch
184,Ambrosius von Mailand,Über die Jungfräulichkeit,Über die Jungfräulichkeit,3,"Ja, du bist nur um einen Schritt, du bist soeben aus den Händen der Verfolger entronnen, du bist noch nicht unterlegen den Mächten der Welt, siehe, da eilt Christus bereits dir entgegen und gestattet nicht, daß deine Prüfung länger währe.",40,deutsch
