id,author,work_title,title,section,text,word_count,language
185,Ambrosius von Mailand,Über die Jungfräulichkeit,Über die Jungfräulichkeit,4,"Dann kannst du, wenn du so den Herrn gesucht und gefunden hast, sagen: „Ich hielt ihn und will ihn nimmer lassen, bis ich ihn bringe ins Haus meiner Mutter, in das Gemach meiner Gebärerin. Was ist dieses Haus und Gemach deiner Mutter, wenn nicht die innerste Tiefe deines Wesens?Dieses Haus bewahre rein und unbefleckt von der Schmach sinnlichen Begehrens: dann wird wie auf heiligem Fundamente zum erhabenen Priesterthum hier dein geistig Haus sich erbauen, und der Geist Gottes wird in ihm wohnen.",82,deutsch
186,Ambrosius von Mailand,Über die Jungfräulichkeit,Über die Jungfräulichkeit,5,"Wer so Christus sucht und bittet, der wird von ihm nicht verlassen, nein, der wird um so öfter das Glück seiner Heimsuchung erfahren. Ist er ja mit uns bis zu der Welt Ende!",33,deutsch
187,Ambrosius von Mailand,Über die Jungfräulichkeit,Über die Jungfräulichkeit,6,"Sagt das hohe Lied: „Er streckte seine Hand durch die Fenster , so deutet das auf das Auge unserer Seele, mit welchem wir die Werke Christi erkennen. Dann blickt unser Geist auf zu ihm, um die Liebe des göttlichen Wortes zu empfangen.",42,deutsch
188,Ambrosius von Mailand,Über die Jungfräulichkeit,Über die Jungfräulichkeit,7,"Halte also offen dein Auge und frei von dem Raube, mit welchem die Sünde es verdunkeln kann. Nicht nach weltlicher Lust soll es schauen, sondern nur auf ihn mit reinem, jungfräulichem Blicke. In gleicher Weise sei auch dein Ohr geschlossen: sein einziger Schmuck sei — mit Verachtung allen Gehänges — der treue Entschluß, zu hören, was zu ewigem Nutzen gereicht.",60,deutsch
189,Ambrosius von Mailand,Über die Jungfräulichkeit,Über die Jungfräulichkeit,8,"Das Thor aber, das du zur Nachtzeit sollst geschlossen halten, daß Niemand eintreten könne, ist unser Mund, welcher sich kaum jemals öffnen soll, wenn nicht Christus gerufen. Darum heißt es ja auch: „Ein verschlossener Garten bist du, meine Schwester, meine Braut! ein verschlossener Garten, eine versiegelte Quelle.",47,deutsch
190,Ambrosius von Mailand,Über die Jungfräulichkeit,Über die Jungfräulichkeit,9,"Soll nun dein Mund sich öffnen zu thörichtem, eitlen Gerede, da du über himmlische Dinge nicht einmal reden darfst, wenn du nicht dem Rufe des ewigen Wortes entgegnest? Was kümmern dich alle Anderen? Nur mit Christus sollst du reden! Wenn einst niedergeschrieben wurde, daß die Frauen in der Kirche schweigen sollten, um wie viel weniger ziemt es dann Jungfrauen und Wittwen, bei jeder Gelegenheit ihren Mund zu öffnen?",68,deutsch
191,Ambrosius von Mailand,Über die Jungfräulichkeit,Über die Jungfräulichkeit,10,"Wie leicht kann da ein Wort wider die Tugend dir entschlüpfen, das du vergebens dann zurückrufen möchtest?",17,deutsch
192,Ambrosius von Mailand,Über die Jungfräulichkeit,Über die Jungfräulichkeit,11,"Hätte Eva diese Vorschrift der Schweigsamkeit beachtet, so wäre Adam nicht verführt worden, und sie selbst hätte auf die listige Frage der Schlange nicht geantwortet. Eva aber schaute hin auf die Frucht, und so trat der Tod durchdie Augen ein in ihre Seele, als sie der Schlange antwortete.",48,deutsch
193,Ambrosius von Mailand,Über die Jungfräulichkeit,Über die Jungfräulichkeit,12,"Nicht anders ergeht es dir, wenn du Thörichtes, Sündhaftes oder Vermessenes, ja wenn du auch nur dann redest, wo du es nicht solltest. Geschlossen sollen deine Lippen bleiben, bis die Stimme des Herrn zum Reden dich auffordert.",37,deutsch
194,Ambrosius von Mailand,Über die Jungfräulichkeit,Über die Jungfräulichkeit,13,"Ist dann das Wasser der Taufe niedergerieselt über dein Haupt, dann wirst du mit Christus der Welt absterben, um mit ihm wieder zu erstehen. „Wenn ihr , sagt der Apostel,1„mit Christo den Kindheitslehren dieser Welt abgestorben seid, warum urtheilet ihr noch, als lebtet ihr in der Welt?",47,deutsch
195,Ambrosius von Mailand,Über die Jungfräulichkeit,Über die Jungfräulichkeit,14,"Rühret nicht an, kostet nicht, tastet nicht an Das, was zum Verderben gereicht, wenn man es gebraucht. Fern von dem Keuschen muß jede Verderbtheit sein: begrabet also für immer, was Welt und Fleisch euch an Sorge bereitet! „Wenn ihr nun mit Christo auferstanden seid, so suchet, was droben ist, wo Christus ist, der zur Rechten Gottes sitzet.",57,deutsch
196,Ambrosius von Mailand,Über die Jungfräulichkeit,Über die Jungfräulichkeit,15,"Wenn ihr ihn suchet, so werdet ihr auch den Vater sehen, zu dessen Rechten er sitzet.",16,deutsch
197,Ambrosius von Mailand,Über die Jungfräulichkeit,Über die Jungfräulichkeit,16,"Willst du aber Christus suchen, so darfst du nicht in Aeußerlichkeit dich verlieren, nicht im freien Weltverkehr dich zerstreuen. Was soll diese geschwätzige Zunge, dieser gezierte Gang, dieses neugierige Aufhorchen, dieser üppige Blick? Der Apostel versagt dir irdischen Verkehr, und er heißt dich über die Grenzen der Natur hinaus mit Geistesflügeln zum Himmel dich zu erheben. „Was droben ist, habet im Sinne, nicht was auf der Erde.",67,deutsch
198,Ambrosius von Mailand,Über die Jungfräulichkeit,Über die Jungfräulichkeit,17,"Weil das aber unmöglich ist, so lange wir von den Banden des Leibes gehalten sind, und weil die Seele erst, wenn sie gelöst ist von diesen Banden, sich zum Himmel erschwingen kann, darum fügt er hinzu: „denn ihrseidgestorben, und euer Leben ist verborgen mit Christo in Gott.",47,deutsch
199,Ambrosius von Mailand,Über die Jungfräulichkeit,Über die Jungfräulichkeit,18,"Ist dem so, so hat die Welt keinen Theil mehr an uns; denn Christus ist der Welt gestorben und lebet nun Gott.",22,deutsch
200,Ambrosius von Mailand,Über die Jungfräulichkeit,Über die Jungfräulichkeit,19,"So habe denn wohl Acht, wie Christus gesucht sein will, wie er aber thörichtes Geschwätz nicht liebt. Es öffnet die Jungfrau die Thore ihres Herzens dem ewigen Worte Gottes; „er aber , muß sie mit der Braut sagen, „war weggegangen und entwichen; meine Seele verlor sich selbst, da er redete.",50,deutsch
201,Ambrosius von Mailand,Über die Jungfräulichkeit,Über die Jungfräulichkeit,20,"Sie verlor sich aus der Welt und ihrem Treiben und blieb in Christo. „Ich habe ihn gesucht, sagt sie, „aber ich fand ihn nicht. So ist es: lange und andauernd will er gesucht werden.",34,deutsch
202,Ambrosius von Mailand,Über die Jungfräulichkeit,Über die Jungfräulichkeit,1,"„Da fanden mich die Wächter, die in der Stadt umhergehen. Welches ist diese Stadt, wer sind die Wächter? Das ist jene Stadt, von der geschrieben steht:1„Ihre Thore werden am Tage nicht geschlossen werden, denn Nacht wird nicht daselbst sein. Es ist das himmlische Jerusalem, in welches du nur mit voller, unbefleckter Reinheit treten kannst: nichts Gemeines kann dort eingehen.",59,deutsch
203,Ambrosius von Mailand,Über die Jungfräulichkeit,Über die Jungfräulichkeit,2,"Finden wir nun die Stadt, so wollen wir in sie eintreten und anstaunen ihr Licht, ihre Mauern, ihre Bewohner, ihre Fundamente, und auch die Wächter der Mauern. Wie aber werden wir dort Zugang finden? Dort ist Leben, aber es ist nureinWeg, der zum Leben führt, und dieser Weg ist Christus:ihmalso müssen wir folgen.",53,deutsch
204,Ambrosius von Mailand,Über die Jungfräulichkeit,Über die Jungfräulichkeit,3,"Im Himmel selbst ist die Stadt gegründet. Wie wir dort hingelangen, lehrt uns Johannes, wenn er sagt:2„Und er führte mich im Geiste auf einen großen, hohen Berg und zeigte mir die heilige Stadt Jerusalem, welche von Gott aus dem Himmel herabstieg.",41,deutsch
205,Ambrosius von Mailand,Über die Jungfräulichkeit,Über die Jungfräulichkeit,4,ImGeistealso müssen wir uns dorthin aufschwingen; das Fleisch kann nimmer hin gelangen.,12,deutsch
206,Ambrosius von Mailand,Über die Jungfräulichkeit,Über die Jungfräulichkeit,5,"„Es hatte aber die Stadt eine hohe, große Mauer mit zwölf Thoren, auf den Thoren zwölf Engel, und Namen waren darauf geschrieben, welches die Namen der zwölfStämme Israels sind. Auf den Thoren standen die Namen der Patriarchen, auf den zwölf Grundsteinen der Mauer aber die Namen der Apostel; der Eckstein ist Christus, auf dem der ganze Bau ruhet.",58,deutsch
207,Ambrosius von Mailand,Über die Jungfräulichkeit,Über die Jungfräulichkeit,6,"Gott aber ist außer- und innerhalb, er ist überall; „denn die Stadt hat die Klarheit Gottes. Darum also seid ihr, heilige Jungfrauen und ihr Alle, die ihr gerecht seid und unbefleckt die Reinheit euerer Seele bewahret, darum seid ihr Mitbürger der Heiligen und Hausgenossen Gottes.",45,deutsch
208,Ambrosius von Mailand,Über die Jungfräulichkeit,Über die Jungfräulichkeit,7,"Dort werdet ihr Theil haben an der Herrlichkeit des himmlischen Vaterlandes, wenn ihr Christus dort gesucht habt, wenn ihr eingetreten seid durch den Glauben und kostbare Tugendwerke; dort werdet ihr verklärt sein in dem Lichte, das die Patriarchen umstrahlt, gegründet auf die Apostel, in stetem Verkehr mit den Engeln.",49,deutsch
209,Ambrosius von Mailand,Über die Jungfräulichkeit,Über die Jungfräulichkeit,8,"Wer nun Christus allezeit gesucht hat, der kann, wenn er treu aushält, den Engeln Gottes begegnen, welche die Stadt bewachen. Nur müßte er den Herrn suchen auch auf dem Lager nach den Worten des Psalmisten: „So habe ich dein gedacht auf meinem Lager; bei Nacht, in Erinnerung an jene Worte: „In der Nacht erhebet eure Hände zu meinem Heiligthume.",59,deutsch
210,Ambrosius von Mailand,Über die Jungfräulichkeit,Über die Jungfräulichkeit,9,"Er müßte ihn suchen auch in der Stadt, aber in der Stadt unseres Gottes; auf dem Markte, aber auf jenem, wo der Richter des göttlichen Gesetzes sitzet, und auf den Gassen, wo Jene versammelt sind, welche eingeladen werden zu dem himmlischen Gastmahle.",42,deutsch
211,Ambrosius von Mailand,Über die Jungfräulichkeit,Über die Jungfräulichkeit,10,"Wenn aber Jemand geschmückt mit solch hehren Verdiensten zu den Engeln kommt,wie kann er verwundet werden?Es gibt ein gutes Schwert, das heilsame Wunden schlägt. Oder trifft das Wort des Herrn nicht so, ohne zu schaden? Das sind die Wunden der Liebe; und „besser sind die Wunden des Liebenden, als die listigen Küsse des Hassers. 3Das Wort des Herrn läutert und reinigt. „Selig aber sind, die ein reines Herz haben, denn sie werden Gott anschauen.",74,deutsch
212,Ambrosius von Mailand,Über die Jungfräulichkeit,Über die Jungfräulichkeit,1,"So suche ihn denn, jungfräuliche Seele! Doch nein, suchen wir ihn vielmehr Alle! Mit Gebet und heissem Flehen müssen wir Gott einladen, daß er mit dem milden Hauche seiner Gnade uns berühre, daß er das überströmende milde Erbarmen desWortesuns zuwende. So sagt die Braut des hohen Liedes: „Er setzte mich auf die Wagen Aminadabs. 1So lange nämlich unsere Seele im Körper weilt, gleicht sie einem Wagen mit unbändigen Rossen, und sie bedarf deßhalb eines kundigen Lenkers.",76,deutsch
213,Ambrosius von Mailand,Über die Jungfräulichkeit,Über die Jungfräulichkeit,2,"Aminadab war der Vater Naasons, eines Fürsten in Juda; er ist ein Vorbild Christi, der als der wahre König seines Volkes auch unsere Seele mit dem Zügel seines Wortes lenkt, damit sie nicht in den Abgrund versinkt, gleich den Wagen, von wildgewordenen, unbändigen Rossen gezogen.",45,deutsch
214,Ambrosius von Mailand,Über die Jungfräulichkeit,Über die Jungfräulichkeit,3,"Vier Rossen gleich sind die Leidenschaften unserer Seele: Zorn, Habgier, Wollust, Furcht. Unter ihrer Herrschaft kennt die Seele sich selbst nicht: der irdische Leib beschwert die Seele und reißt sie wider ihren Willen mit der Gewalt unsinniger Thiere fort. Dann folgt sie unaufhaltsam dem Anstoß der Leidenschaft, bis diese unter dem mächtigen Drucke des göttlichen Wortes sich beruhigt.",58,deutsch
215,Ambrosius von Mailand,Über die Jungfräulichkeit,Über die Jungfräulichkeit,4,"So handelt der Hirt unserer Seele, einem weisen Wagenlenker vergleichbar; er hindert, daß der sterbliche Leib der unsterblichen Seele die Freiheit der Bewegung raube.",24,deutsch
216,Ambrosius von Mailand,Über die Jungfräulichkeit,Über die Jungfräulichkeit,5,"Vor Allem soll man deßhalb die leidenschaftlichen Regungen der sinnlichen Natur beherrschen und mittels derVernunft zügeln. Aber auch darauf soll man sehen, daß Gleichmäßigkeit in dem Gebrauche der Fähigkeiten waltet, damit es nicht so ergeht, als wenn ein langsames, träges Roß hindert, oder als wenn ein stürmisches stete Unruhe bereitet: leicht bäumt sich das wilde, boshafte Roß, belästigt das Nebengespann und bringt, sich überschlagend, das Gefährt zum Sturze.2Hier soll nun der gute Lenker besänftigen, wie Christus es thut, der auf das Feld der Wahrheit uns führt und den zerschmetternden Fall in die Tiefen des Irrthums verhindert.",96,deutsch
217,Ambrosius von Mailand,Über die Jungfräulichkeit,Über die Jungfräulichkeit,6,"Zum Himmel droben führt sicherer Weg, aber abwärts birgt der Weg viele Gefahren. Wer dann treu das Joch des Wortes getragen, der kommt zum Hause des Herrn, wo seiner als Nahrung harret das Brod, das vom Himmel herabgekommen ist.",39,deutsch
218,Ambrosius von Mailand,Über die Jungfräulichkeit,Über die Jungfräulichkeit,7,"Das Citat Hoh. L. 6, 11 („posuit me currus Aminadab ) ist nach den LXX:„ἔθετί με ἅρματα Ἀμιναδάβ [etheti me harmata Aminadab]. Die Vulgata übersetzt: Anima mea conturbavit me propter quadrigas Aminadab. Ein Blick auf den Zusammenhang wird die Behauptung rechtfertigen, daß Ambrosius wohl niemals ein weniger passendes Citat verwendet hat.",51,deutsch
219,Ambrosius von Mailand,Über die Jungfräulichkeit,Über die Jungfräulichkeit,8,Ueberhaupt leidet diese ganze Abhandlung an einer bis zur mitunter Willkür sich steigernden Spielerei im Gebrauch von Stellen der hl. Schrift.,21,deutsch
220,Ambrosius von Mailand,Über die Jungfräulichkeit,Über die Jungfräulichkeit,9,"Der lateinische Text vermischt Bild und Wirklichkeit: fremit equus malitiae, seseque jactando currum laedit, gravat jugalem etc. etc. Man muß hier und bei einigen folgenden Stellen an einer wörtlichen Uebersetzung verzweifeln.",31,deutsch
221,Ambrosius von Mailand,Über die Jungfräulichkeit,Über die Jungfräulichkeit,1,"Damit wir aber nicht ferner gefährlichem Falle ausgesetzt seien, so wird das ewige Wort eingeladen, herniederzusteigen in jenenNußgarten,1in dem die gnadenreichen Früchte priesterlichen Lebens reifen, das so harte Prüfungen auflegt, das so voll von anstrengender Arbeit, aber auch so fruchtbar an heiliger Tugend ist.",44,deutsch
222,Ambrosius von Mailand,Über die Jungfräulichkeit,Über die Jungfräulichkeit,2,"So ergrünte ja auch der Stab Aarons nicht in natürlicher Weise, sondern lediglich durch göttliche Kraft. Ja, der Herr möge herniedersteigen in seinen Garten, um die Früchte des Glaubens dort zu ernten und an dem Dufte der Blüthen sich zu laben, nach den Worten:2„Ich habe gepflückt meine Myrrhe mit meinen Gewürzen, gegessen mein Brod mit meinem Honig.",57,deutsch
223,Ambrosius von Mailand,Über die Jungfräulichkeit,Über die Jungfräulichkeit,3,"Aus den Blüthen verschiedener Tugend sammelt die Kirche,der Biene vergleichlich, um geistigen Honig, gleichsam zur Speise für den Herrn, zu bereiten.",21,deutsch
224,Ambrosius von Mailand,Über die Jungfräulichkeit,Über die Jungfräulichkeit,4,"Alles also haben wir in Christo. Jede Seele soll zu ihm hingehen, gleichviel ob sie an Fleischessünden todtkrank ist, wie mit Nägeln festgeheftet an sündhafte Begierden, oder ob sie, trotz ihrer Bemühungen in Gebet und Betrachtung, noch in Unvollkommenheit wanket, oder ob sie endlich in einzelnen Tugenden bereits die Höhe der Vollkommenheit erstiegen hat: jede Seele ist in der mächtigen Hand des Herrn, und Christus ist für uns Alles.",69,deutsch
225,Ambrosius von Mailand,Über die Jungfräulichkeit,Über die Jungfräulichkeit,5,"Willst du, daß deine Wunde heile: er ist der Arzt; glühst du vor Fieberhitze: er ist erfrischende Quelle; sinkst du zusammen unter der Ungerechtigkeit deiner Werke: er ist die ewige Gerechtigkeit; bedarfst du der Hilfe: er ist die Allmacht; fürchtest du den Tod: er ist das Leben; verlangst du zum Himmel: er ist der Weg; willst du die Finsterniß fliehen: er ist das Licht; suchst du Speise: er ist das Brod des Lebens. „Kostet also und sehet, wie süß der Herr ist; selig der Mann, der auf ihn hoffet. 3",90,deutsch
226,Ambrosius von Mailand,Über die Jungfräulichkeit,Über die Jungfräulichkeit,6,"Auf ihn hoffte jenes Weib, das am Blutflusse litt und alsbald geheilt wurde, weil sie vertrauend zu ihm hintrat. So tritt auch du hin, meine Tochter, berühre vom Glauben beseelt den Saum seines Gewandes. Alsbald wird der überwallende Strom deiner sinnlichen Begierden erstarren, wenn du nur gläubig voll Verehrung das leiseste Wort aus seinem göttlichen Munde annimmst, wenn du zitternd niedersinkest zu den Füßen des Herrn.",66,deutsch
227,Ambrosius von Mailand,Über die Jungfräulichkeit,Über die Jungfräulichkeit,7,"O Glaube, kostbarer als alle Schätze! stärker als alle Macht der Welt! heilbringender, als alle Wissenschaft des Arztes! Kaum trat das Weib zu ihm hin, so fühlte sie schon die Kraft und erlangte Heilung. So trifft der Strahl, wenn du dein Auge dem Lichte zuwendest, dich erleuchtend, noch ehe du dessen inne wirst, und die Wirkung ist da, ehe du sie fühlst.",62,deutsch
228,Ambrosius von Mailand,Über die Jungfräulichkeit,Über die Jungfräulichkeit,8,"Altes, unheilbares Leiden, das aller Kunst der Aerzte spottet, das nicht weicht trotz des aufgewendeten ganzen Vermögens, wird geheilt beider bloßen Berührung des Gewandes. Sowie jenes Weib, sollst du, o Jungfrau, in Ehrfurcht dem Herrn dich nahen, in festem Glauben ihn verehren.",42,deutsch
229,Ambrosius von Mailand,Über die Jungfräulichkeit,Über die Jungfräulichkeit,9,"Wie groß ist nun die Begnadigung, wenn diejenige, welche sich scheut, vor die Menschen hinzutreten, sich nicht schämt, ihren Fehler zu bekennen! Verheimliche deine Fehltritte nicht, bekenne nur muthig, was der Herr doch schon weiß; schäme dich nicht, dessen auch die Propheten sich nicht schämten. „Heile mich, o Herr! und ich werde geheilt werden! spricht Jeremias.4So sprach auch jenes Weib, das den Saum des Gewandes Christi berührte: „Heile mich, Herr! und ich werde geheilt werden; rette mich, und ich werde gerettet sein; denn du, o Herr, bist mein Ruhm und mein Preis, und genesen wird nur, den du heilest.",99,deutsch
230,Ambrosius von Mailand,Über die Jungfräulichkeit,Über die Jungfräulichkeit,10,"Will nun Jemand dir einwenden, weil auch die Gläubigen gar manche Versuchung erdulden müssen: „Wo ist des Herrn Wort? Es komme doch! — so vergiß nicht, daß auch zu dem Herrn einst gesagt wurde: „Er möge herabsteigen vom Kreuze, so wollen wir ihm glauben; er hat auf den Herrn vertraut, der rette ihn jetzt, wenn er ein Wohlgefallen an ihm hat.",61,deutsch
231,Ambrosius von Mailand,Über die Jungfräulichkeit,Über die Jungfräulichkeit,11,"Wenn man in solcher Weise höhnend zu dir spricht, als ruhe dein Vertrauen auf thörichter Fabel, so antworte nimmer. Wollte doch auch Christus die Spötter nicht eines einzigen Wortes würdigen! Ihn allein sollst du fragen, nur ihm antworten. Redest du zu jenen, sie glauben dir nicht; fragst du sie, so lassen sie dich ohne Antwort.",55,deutsch
232,Ambrosius von Mailand,Über die Jungfräulichkeit,Über die Jungfräulichkeit,12,"So sprich denn mit dem Propheten zu deinem Heilande: „Ich war ohne Beschwerden, da ich dir folgte, und Menschentage habe ich nicht begehrt. 5",24,deutsch
233,Ambrosius von Mailand,Über die Jungfräulichkeit,Über die Jungfräulichkeit,13,"So sprach auch jenes Weib, und sofort war sie geheilt. Obgleich matt und krank, da sie so lange den Herrn gesucht hatte, sprach sie doch: „Ich hatte keine Beschwerden, da ich dir folgte. So ist es in der That: wer Christus folgt, der fühlt keine Beschwerden, weil er die Mühseligen gerade zu sich ruft, um sie zu erquicken.",58,deutsch
234,Ambrosius von Mailand,Über die Jungfräulichkeit,Über die Jungfräulichkeit,14,"So folgen wir ihm denn, von dem mit Recht der Prophet sagt:6„Die auf den Herrn hoffen, erneuern ihre Kraft, befiedern sich wie Adler, laufen und werden nicht müde, gehen und werden nicht matt.",33,deutsch
235,Ambrosius von Mailand,Über die Jungfräulichkeit,Über die Jungfräulichkeit,15,"So scheuen wir denn nicht das Bekenntniß. Mit Jeremias können wir sagen: „Du weißt es, o Herr! was herausging aus meinen Lippen, lag stets offen vor dir. Darum scheue ich mich nicht, die eigenen Sünden zu bekennen, und zu bitten: „Laß zu Schanden werden, die mich verfolgen, aber mich laß nicht zu Schanden werden!",54,deutsch
236,Ambrosius von Mailand,Über die Jungfräulichkeit,Über die Jungfräulichkeit,16,"Petrus scheute sich nicht zu rufen: „Weiche von mir, Herr! denn ich bin ein sündiger Mensch. Der weise, hehre Mann, in dem die Kraft der Kirche ruht und das höchste Amt der Leitung: er erkennt, daß es für ihn nichts Nützlicheres gebe, als sich über den Erfolg des unternommenen Werkes nicht zu überheben.",53,deutsch
237,Ambrosius von Mailand,Über die Jungfräulichkeit,Über die Jungfräulichkeit,17,"Darum sagt er: „Weiche von mir, Herr! Er bittet nicht in der Absicht, verlassen zu werden, sondern lediglich, um sich vor Hochmuth zu bewahren.",24,deutsch
238,Ambrosius von Mailand,Über die Jungfräulichkeit,Über die Jungfräulichkeit,18,"Auch Paulus redet von dem Stachel des Fleisches, der bewirke, daß er selbst sich nicht überhebe. Gefährlich, einschmeichelnd muß dieser Stolz sein, da selbst Paulus ihn fürchtet. Und doch ist der nicht leicht zum Falle zu bringen, der fürchtet, sich um der empfangenen Offenbarungen willen überheben zu können.",48,deutsch
239,Ambrosius von Mailand,Über die Jungfräulichkeit,Über die Jungfräulichkeit,19,"Aber einem tapferen Kämpfer gleichfreut er sich, unter den Gefahren, welche die Leiblichkeit ihm bereitet, die Seele zu bewahren und zu retten.",22,deutsch
240,Ambrosius von Mailand,Über die Jungfräulichkeit,Über die Jungfräulichkeit,20,"Jerem. 17, 16 ff. Der Prophet meint mit dem Uebel, von dem er geheilt werden will, die Nichterfüllung der im Namen Jehovahs gegebenen Weissagung. Die Beziehung ist hier also nicht besonders zutreffend.",32,deutsch
241,Ambrosius von Mailand,Über die Jungfräulichkeit,Über die Jungfräulichkeit,21,"Ambrosius übersetzt den Text der LXX:Ἐγὼ δὲ οὐκ ἐκοπίασα κατακολουθῶν ὀπίσω σου[egō de ouk ekopiasa katakolouthōn opisō sou] (ganz wie das neue Testamentκοπιάω[kopiaō] für „sich abmühen gebraucht): Ego non laboravi, sequens post te. Damit ist freilich der Sinn des Propheten nicht getroffen, da dieser vielmehr sagen will, daß er nie seinem eigenen Willen nachgegeben habe, sondernstetsdem Herrn gefolgt sei. „Ich strebe nicht hinweg, mich nicht zu halten hinter dir hat der hebräische Text.",73,deutsch
242,Ambrosius von Mailand,Über die Jungfräulichkeit,Über die Jungfräulichkeit,1,"So sollst auch du, wenn du erkennst, wie die göttlichen Gnadengeschenke überreichlich dir zuströmen, deine eigene Tugend wohl abmessen. Gott dem Herrn zolle Dank, betrachte die Armseligkeit deines Leibes, wie man den Ballast eines Schiffes ansiehet. Laß dich nie in den mächtigen Wogen dieser Welt von dem gefahrdrohenden Winde des Hochmuthes dahintreiben.",52,deutsch
243,Ambrosius von Mailand,Über die Jungfräulichkeit,Über die Jungfräulichkeit,2,"So verläßt die Biene, wenn sie heftigere Luftströmungen bemerkt, ihr Versteck unter kleinen Steinchen erst dann, wenn sie durch ruhige, stille Luft hinfliegen kann, damit die Windstöße das schwache Ruder ihrer kleinen Flügel nicht zerbrechen. — So glaubten Paulus und Barnabas schon durch den bloßen Anblick des heidnischen Opfers ihr Gewissen zu beschweren.",53,deutsch
244,Ambrosius von Mailand,Über die Jungfräulichkeit,Über die Jungfräulichkeit,3,"So hüte auch du dich, jungfräuliche Seele, daß die Strömungen dieser Welt dich nicht zu unbesonnenem Fluge veranlassen.",18,deutsch
245,Ambrosius von Mailand,Über die Jungfräulichkeit,Über die Jungfräulichkeit,4,"Auch die Seele hat ja ihre Flügel, wie der Prophet sagt:1„Wer sind die, welche wie Wolken daher fliegen und wie Tauben mit ihren Jungen? So durchfliegt die Seele in einem Augenblicke den Erdkreis. Ungehindert sind die Gedanken der Weisen; aber zu je höherem Fluge bis zum Himmel selbst sie sich erheben, desto weniger werden sie durch irdische Hindernisse zurückgehalten.",59,deutsch
246,Ambrosius von Mailand,Über die Jungfräulichkeit,Über die Jungfräulichkeit,5,"Derjenige, welcher Gott anhängt und das göttliche Abbild seiner Seele treu in sich bewahrt, der schwingt sich, getragen von dem Hauche der Gnade, empor bis zu jenem erhabenen Orte, wo Gott selber thront: dann aber verachtet er Alles, was in der Welt ist.",43,deutsch
247,Ambrosius von Mailand,Über die Jungfräulichkeit,Über die Jungfräulichkeit,6,"Das Auge unverwandt auf die ewigen Tugenden gerichtet, steigt er über die Welt hoch hinaus. Ueberihr Könnengeht ja die Gerechtigkeit, die Keuschheit, die Güte,die Liebe, die Weisheit: finden sich diese Tugendeninder Welt, so sind sie doch nicht in ihr erwachsen, sondern von oben in sie verpflanzt.",46,deutsch
248,Ambrosius von Mailand,Über die Jungfräulichkeit,Über die Jungfräulichkeit,7,"Das gestand selbst Satan, da er alle Reiche der Welt und ihre Herrlichkeit bot. Darum konnte der Herr sagen: „Es kommt der Fürst dieser Welt, aber an mir hat er Nichts. Lernet denn auch ihr, in der Welt und doch ihr entrückt sein.",43,deutsch
