id,author,work_title,title,section,text,word_count,language
168,Aristides von Athen,Apologie,Apologie,14,"Joh. 7,24; Did. 4,3; Barn. 19,11; vgl. Is. 1,17 (1Klem. 8,4).",11,deutsch
169,Aristides von Athen,Apologie,Apologie,15,"Apg. 15,; Cantabr. Did. 1,2; vgl. Tob. 4,15; Matth. 7,12; Luk. 6,31.",12,deutsch
170,Aristides von Athen,Apologie,Apologie,16,"Joh. 13,34; 15,; 1Joh. 4, f.; 1Petr. 1,22.; 2Klem. 9,6; Br. a. Diogn. 1.",14,deutsch
171,Aristides von Athen,Apologie,Apologie,17,von den W. wenden sie ihren Blick nicht ab S.,10,deutsch
172,Aristides von Athen,Apologie,Apologie,18,"Vgl. 1Tim. 5,3; Jak. 1,27; Barn 20,2; Herm., Mand. 8,10; Sim. 1,8 und schon Is. 1,17; Sir. 32 (35),17.",19,deutsch
173,Aristides von Athen,Apologie,Apologie,19,"2Kor. 8,14; 9,12; Eph. 4,28; 1Tim. 6,18; 1Joh 3,17; Did. 4,8.",11,deutsch
174,Aristides von Athen,Apologie,Apologie,20,"Matth. 10,22; Mark. 13,13; Joh. 15,21; Apg. 5,41; 1Petr. 4,; vgl. Justin, Apol. I 4; Tertullian, Ad nat. I 3",20,deutsch
175,Aristides von Athen,Apologie,Apologie,21,"Tit. 2,12. G: heilig und rechtschaffen; vgl. 1Thess. 2,10; Petruspred.: Strom. VI 5,41; 2Klem. 5,6 (6,9).",16,deutsch
176,Aristides von Athen,Apologie,Apologie,22,"Vgl. Eph. 5,19 f; Kol. 3,16 f.; 1Thess. 5,18; Justin, Apol. I 13,1 f.",14,deutsch
177,Aristides von Athen,Apologie,Apologie,1,"1. Als solche, die Gott kennen, bitten sie ihn (nur) um Dinge, die ihm wohl anstehen zu geben und ihnen zu empfangen. So füllen sie ihre Lebenszeit aus. Und da sie Gottes Wohltaten gegen sie erkennen, siehe! so strömen ihretwegen die Segnungen in der Welt fort1.",46,deutsch
178,Aristides von Athen,Apologie,Apologie,2,"Und wahrhaftig sind sie es, die umher suchend die Wahrheitgefunden haben. Und aus dem, was wir vernommen, haben wir geschlossen, daß sie allein der Erkenntnis der Wahrheit nahestehen.",28,deutsch
179,Aristides von Athen,Apologie,Apologie,3,"2. Die Wohltaten, die sie spenden, rufen sie nicht in die Ohren der Menge; sie sind (vielmehr) besorgt, daß sie niemand bemerke, und verheimlichen ihre Gabe2wie einer, der einen Schatz3gefunden hat und ihn geheim hält. Sie bemühen sich gerecht4zu sein, erwarten5sie ja in großer Herrlichkeit6ihren Christus zu sehen und die ihnen gemachten Verheißungen7von ihm zu empfangen. 3.",57,deutsch
180,Aristides von Athen,Apologie,Apologie,4,"Ihre Sprüche und Gebote aber, o Kaiser, den Ruhm ihres (Gottes-) Dienstes und den Lohn8[der Vergeltung], den sie entsprechend dem Tun eines jeden9einzelnen von ihnen in der andern Welt erwarten, magst du aus ihren Schriften kennen lernen. 4. Uns aber genügt es, in Kürze Eurer Majestät den Wandel und die Wahrheit der Christen kundgetan zu haben; denn wahrhaft groß und wunderbar ist ihre Lehre für den, der sie betrachten und verstehen will, und wahrhaft neu10ist dies Volk und eine göttliche Mischung ist in ihm11.",84,deutsch
181,Aristides von Athen,Apologie,Apologie,5,"5. Nehmt also ihre Schriften her und lest darin12, und siehe! Ihr werdet finden, daß ich dies nicht aus mir selbst geschöpft oder als ihr Anwalt gesprochen habe, sondern, nachdem ich nun einmal in ihren Schriften gelesen habe, bin ich davon fest überzeugt13, auch von dem Zukünftigen14.",47,deutsch
182,Aristides von Athen,Apologie,Apologie,6,"Darum fühlte ich mich auchgedrängt, denen die Wahrheit zu zeigen, die ihr geneigt sind und die künftige Welt suchen. 6. Auch hege ich keinen Zweifel, daß (nur) durch das flehentliche Gebet der Christen die Welt noch fortbesteht15. Die übrigen Völker aber gehen und führen irre16, indem sie sich vor die Elemente der Welt hinwälzen, will ja ihr Geistesblick nicht drüber hinwegsehen.",61,deutsch
183,Aristides von Athen,Apologie,Apologie,7,"Sie tasten wie im Dunkeln17, da sie die Wahrheit nicht erkennen wollen, und taumeln wie Trunkene, ziehen einander hin und fallen.",21,deutsch
184,Aristides von Athen,Apologie,Apologie,8,"Vgl. Röm. 8,14 ff.; Joh 1,12 f.: 1Joh. 3,1 f. 9f.; 4,7; 5,.",13,deutsch
185,Aristides von Athen,Apologie,Apologie,9,"Justin, Apol. II 7,1; Br. a. Diogn. 6,7; Tertull. Apol. 39,2.",11,deutsch
186,Aristides von Athen,Apologie,Apologie,1,"1. Bis hierher, o Kaiser, habeichgesprochen. Bezüglich des übrigen finden sich, wie oben bemerkt1, in ihren andern Schriften Worte, die schwer zu sagen und von jemand vorzutragen sind, (Worte) die nicht bloß geredet, sondern auch befolgt sein wollen2.",38,deutsch
187,Aristides von Athen,Apologie,Apologie,2,"2. Die Griechen hingegen, o Kaiser, weil schändliche Dinge verübend durch Beilager mit Männlichen3und mit Mutter, Schwester und Tochter, schieben den Hohn ihrer Unlauterkeit auf die Christen4. Die Christen jedoch sind rechtschaffen und heilig5und die Wahrheit steht ihnen vor Augen. 3. Sie sind auch langmütig6.",45,deutsch
188,Aristides von Athen,Apologie,Apologie,3,"Und weil sie wissen, daß jene im Irrtum sind, lassen sie sich von ihnen schlagen, ertragen und dulden7sie, ja noch mehr, sie behandeln sie schonend als Leute, die der Erkenntnis ermangeln8, und bringen für sie Gebet(e) dar9, damit sie sich von ihrem Irrtumbekehren. 4.",44,deutsch
189,Aristides von Athen,Apologie,Apologie,4,"Kommt es indes vor, daß einer von ihnen sich bekehrt, so schämt er sich vor den Christen seiner begangenen Missetaten, bekennt (sie) Gott und spricht: „Aus Unwissenheit habe ich diese begangen 10. Und er reinigt sein Herz, und seine Sünden werden ihm nachgelassen, weil er sie aus Unwissenheit11in der früheren Zeit beging, wo er (noch) die wahre Erkenntnis der Christen lästerte und schmähte. 5.",64,deutsch
190,Aristides von Athen,Apologie,Apologie,5,Ja wahrhaft selig ist das Geschlecht der Christen vor allen Menschen auf der Erdoberfläche.,14,deutsch
191,Aristides von Athen,Apologie,Apologie,6,"6. Verstummen sollen nunmehr die Zungen derer, die Eitles reden und die Christen verleumden, und sie sollen jetzt die Wahrheit sagen. Denn es frommt ihnen mehr, den wahren Gott anzubeten, als einen unbestimmten Schall12. 7. Und wahrhaft ist Gottes13, was durch der Christen Mund geredet wird14, und ihre Lehre ist die Pforte des Lichts15. 8.",55,deutsch
192,Aristides von Athen,Apologie,Apologie,7,"Es sollen sich ihr nun alle die nahen, die Gott (noch) nicht erkannt haben, und sollen die unvergänglichen Worte aufnehmen, die von jeher sind und von Ewigkeit. Mögen sie also zuvorkommen dem furchtbaren Gericht16, das durch Jesus Christus über das ganze Menschengeschlecht kommen soll17.",44,deutsch
193,Aristides von Athen,Apologie,Apologie,8,"Vgl. Apg. 3,; 17,30; 1Petr. 1,14; Petruspred.: Strom. VI 6,48.",10,deutsch
194,Aristides von Athen,Apologie,Apologie,9,"Denn groß ist und wunderbar, was von den Christen geredet und getan wird; denn nicht der Menschen, sondern Gottes Worte reden sie G; vgl. 2Klem. 13,3.",26,deutsch
195,Aristides von Athen,Apologie,Apologie,10,"Apg. 17,31; Röm. 1,18; Kol. 3,6; 1Petr. 4,17; Justin, Apol. I 68,2; Br. a. Diogn. 7,6.",16,deutsch
196,Aristides von Athen,Apologie,Apologie,11,Die syrische HS fügt bei: Zu Ende ist die Apologie des Philosophen Aristides.,13,deutsch
